tweet_text,recipient,emotion,brand,lemmatized_review,emotion_code
"['late', 'finally', 'gsdm', 'google', 'sxsw', 'great', 'surprise', 'b', 'greeted', 'lovely', 'lindsay', 'stillman', 'going', 'b', 'good', 'night']",Google,Positive emotion,Google,late finally gsdm google sxsw great surprise b greeted lovely lindsay stillman going b good night,3
"['everyone', 'buy', 'user', 'app', 'new', 'ipad', 'day', 'birth', 'happy', 'happy', 'sxsw', 'gsdm']",iPad or iPhone App,Positive emotion,Apple,everyone buy user app new ipad day birth happy happy sxsw gsdm,3
"['buy', 'ipad', 'user', 'makeshift', 'sxsw', 'apple', 'store', 'launch', 'day', 'fuck', 'respect', 'much', 'wwsxsw']",iPad,Negative emotion,Apple,buy ipad user makeshift sxsw apple store launch day fuck respect much wwsxsw,1
"['walk', 'lady', 'bird', 'lake', 'lovely', 'google', 'map', 'travel', 'time', 'trusted', 'sxsw']",Other Google product or service,Negative emotion,,walk lady bird lake lovely google map travel time trusted sxsw,1
"['quotby', 'law', 'average', 'better', 'buzzquot', 'rt', 'user', 'quotgoogle', 'circle', 'quot', 'sxsw']",none,Positive emotion,none,quotby law average better buzzquot rt user quotgoogle circle quot sxsw,3
"['ironic', 'tee', 'usurped', 'ipad', '2', 'hipstergeekstartup', 'chic', 'fashion', 'item', 'year', 'sxsw']",iPad,Positive emotion,Apple,ironic tee usurped ipad 2 hipstergeekstartup chic fashion item year sxsw,3
"['ipad', 'calendar', 'frankeninterface', 'designed', 'one', 'interface', 'metaphor', 'us', 'another', 'tapworthy', 'sxsw']",none,Negative emotion,none,ipad calendar frankeninterface designed one interface metaphor us another tapworthy sxsw,1
"['sxsw', 'macallan', 'formula', 'successful', 'day', 'sxsw', 'good', 'session', 'ipad', 'glass', 'macallan', 'single', 'malt', 'link']",iPad,Positive emotion,Apple,sxsw macallan formula successful day sxsw good session ipad glass macallan single malt link,3
"['user', 'wait', 'ipad', '2', 'also', 'sale', 'sxsw']",iPad,Positive emotion,Apple,user wait ipad 2 also sale sxsw,3
"['music', 'location', 'mobile', 'recording', 'meet', 'user', 'io', 'android', 'update', 'time', 'sxsw', 'link']",none,Positive emotion,none,music location mobile recording meet user io android update time sxsw link,3
"['sxsw', 'enchantment', 'user', 'quotno', 'one', 'us', 'window', 'voluntarilyquot', 'quotapple', 'greatest', 'collection', 'egomaniac', 'historyquot', 'haha']",Apple,Negative emotion,Apple,sxsw enchantment user quotno one us window voluntarilyquot quotapple greatest collection egomaniac historyquot haha,1
"['sxsw', 'enchantment', 'user', 'quotsell', 'dream', 'steve', 'job', 'say', 'iphone', '188', 'partsatampt', 'made', 'people', 'suicidal', 'chinese']",iPhone,Negative emotion,Apple,sxsw enchantment user quotsell dream steve job say iphone 188 partsatampt made people suicidal chinese,1
"['user', 'check', 'rt', 'user', 'sxsw', 'free', 'app', 'festival', 'explorer', 'find', 'band', 'want', 'see', 'music', 'taste', 'link']",iPad or iPhone App,Positive emotion,Apple,user check rt user sxsw free app festival explorer find band want see music taste link,3
"['user', 'check', 'user', 'awesome', 'dj', 'skill', 'ipad', 'sxsw']",iPad,Positive emotion,Apple,user check user awesome dj skill ipad sxsw,3
"['user', 'check', '2011', 'south', 'southwest', 'interactive', 'iphoneipad', 'musthave', 'apps', 'site', 'tool', 'user', 'link', 'sxsw']",iPad or iPhone App,Positive emotion,Apple,user check 2011 south southwest interactive iphoneipad musthave apps site tool user link sxsw,3
"['user', 'check', 'eventseekr', 'app', 'launching', 'sxsw', 'keep', 'updated', 'party', 'android', 'link', 'iphone', 'app', 'way']",Android App,Positive emotion,Google,user check eventseekr app launching sxsw keep updated party android link iphone app way,3
"['user', 'check', 'smyle', 'android', 'web', 'group', 'chat', 'shared', 'location', 'medium', 'whiteboarding', 'thanks', 'sxsw', 'app']",Android App,Positive emotion,Google,user check smyle android web group chat shared location medium whiteboarding thanks sxsw app,3
"['check', 'quotmistakes', 'made', 'building', 'netflix', 'iphonequot', 'going', 'cool', 'always', 'learn', 'mistake', 'sxsw']",iPad or iPhone App,Positive emotion,Apple,check quotmistakes made building netflix iphonequot going cool always learn mistake sxsw,3
"['user', 'check', 'latest', 'stream', 'apple', 'store', 'sxsw', 'link', 'ipad2', 'come', 'playsxsw']",iPad,Positive emotion,Apple,user check latest stream apple store sxsw link ipad2 come playsxsw,3
"['user', 'check', 'latest', 'stream', 'apple', 'store', 'sxsw', 'link', 'ipad2', 'wait', 'playsxsw']",iPad,Positive emotion,Apple,user check latest stream apple store sxsw link ipad2 wait playsxsw,3
"['launched', 'popup', 'apple', 'store', 'sxsw', 'quotvintagequot', 'store', 'format', 'mostly', 'ipod', 'snarky', 'employee', 'ah', 'good', 'old', 'day']",Apple,Negative emotion,Apple,launched popup apple store sxsw quotvintagequot store format mostly ipod snarky employee ah good old day,1
"['saveustechies', 'panel', 'sxsw', 'getting', 'great', 'start', 'video', 'surui', 'carbon', 'project', 'google', 'link']",Google,Positive emotion,Google,saveustechies panel sxsw getting great start video surui carbon project google link,3
"['stupid', 'technology', 'always', 'fail', 'important', 'time', 'sxsw', 'w', 'iphone', 'laptop', 'blackberry', 'thing', 'working', 'pen']",iPhone,Negative emotion,Apple,stupid technology always fail important time sxsw w iphone laptop blackberry thing working pen,1
"['official', 'people', 'using', 'ipad', '2', 'take', 'photo', 'look', 'weird', 'sxsw']",iPad,Negative emotion,Apple,official people using ipad 2 take photo look weird sxsw,1
"['official', 'presenting', 'filmaster', 'iphone', 'contest', 'world', 'best', 'mobile', 'apps', 'sxsw', 'link']",iPad or iPhone App,Positive emotion,Apple,official presenting filmaster iphone contest world best mobile apps sxsw link,3
"['official', 'buying', 'ipad', 'sxsw', 'elevate']",iPad,Positive emotion,Apple,official buying ipad sxsw elevate,3
"['pretty', 'excited', 'apple', 'pop', 'store', 'coming', 'sxsw', 'link']",Apple,Positive emotion,Apple,pretty excited apple pop store coming sxsw link,3
"['pretty', 'excited', 'user', 'ipad', 'session', 'uxdes', 'sxsw']",iPad,Positive emotion,Apple,pretty excited user ipad session uxdes sxsw,3
"['pretty', 'excited', 'iphone', 'stop', 'working', 'sxsw', 'atampt']",iPhone,Negative emotion,Apple,pretty excited iphone stop working sxsw atampt,1
"['excited', 'see', 'hl', 'dynamic', 'video', 'ad', 'insertion', 'tv', 'everywhere', 'working', 'ipad2', 'later', 'today', 'sxsw', 'popup', 'apple', 'store']",iPad,Positive emotion,Apple,excited see hl dynamic video ad insertion tv everywhere working ipad2 later today sxsw popup apple store,3
"['ipad2', 'rock', 'sxsw', 'user', 'apple', 'pop', 'store', 'link']",iPad,Positive emotion,Apple,ipad2 rock sxsw user apple pop store link,3
"['first', 'computer', 'kid', 'atari', '800', 'kid', 'first', 'computer', 'ipad', 'able', 'could', 'sxsw']",iPad,Positive emotion,Apple,first computer kid atari 800 kid first computer ipad able could sxsw,3
"['crowdbeacon', 'put', 'together', 'guide', 'sxsw', 'link', 'latest', 'update', 'iphone', 'app', 'going', 'sick']",iPad or iPhone App,Positive emotion,Apple,crowdbeacon put together guide sxsw link latest update iphone app going sick,3
"['second', 'day', 'business', 'apple', 'popup', 'store', 'appears', 'trending', 'sxsw', 'vb', 'user', 'apple', 'store', 'sxsw', 'pic', 'link']",Apple,Positive emotion,Apple,second day business apple popup store appears trending sxsw vb user apple store sxsw pic link,3
"['sxsw', 'conf', 'everyone', 'mac', 'ipad', 'including', 'happened', 'pc', 'becoming', 'obsolete']",iPad,Positive emotion,Apple,sxsw conf everyone mac ipad including happened pc becoming obsolete,3
"['user', 'congrats', 'first', 'ipad', '2', 'sxsw']",iPad,Positive emotion,Apple,user congrats first ipad 2 sxsw,3
"['user', 'congrats', 'iphone', 'app', 'featured', 'sxsw']",iPad or iPhone App,Positive emotion,Apple,user congrats iphone app featured sxsw,3
"['user', 'congratulation', 'winning', 'android', 'award', 'sxsw']",Android,Positive emotion,Google,user congratulation winning android award sxsw,3
"['user', 'congratulation', 'sent', 'seesmic', 'android', 'phone', 'sxsw']",Android App,Positive emotion,Google,user congratulation sent seesmic android phone sxsw,3
"['trying', '2', 'convince', 'user', '2', 'watch', 'launch', 'google', 'social', 'network', 'sxsw', 'know', 'going', 'comedy']",Other Google product or service,Negative emotion,,trying 2 convince user 2 watch launch google social network sxsw know going comedy,1
"['user', 'cool', 'mean', 'watch', 'ustream', 'skyfire', 'browser', 'iphone', 'safari', 'work', 'fun', 'sxsw']",iPhone,Positive emotion,Apple,user cool mean watch ustream skyfire browser iphone safari work fun sxsw,3
"['could', 'cool', 'rt', 'user', 'google', 'launch', 'major', 'new', 'social', 'network', 'called', 'circle', 'possibly', 'today', 'link', 'sxsw']",Other Google product or service,Positive emotion,,could cool rt user google launch major new social network called circle possibly today link sxsw,3
"['eating', 'coolhaus', 'ice', 'cream', 'sandwich', 'google', 'party', 'hmm', 'happy', 'sxsw']",Google,Positive emotion,Google,eating coolhaus ice cream sandwich google party hmm happy sxsw,3
"['really', 'could', 'use', 'one', 'tiny', 'macbook', 'air', 'read', 'apple', 'set', 'temporary', 'store', 'sxsw', 'sxsw']",Apple,Positive emotion,Apple,really could use one tiny macbook air read apple set temporary store sxsw sxsw,3
"['user', 'crew', 'ripped', 'android', 'party', 'thanks', 'u', 'droid', 'link', 'sxsw']",Android,Positive emotion,Google,user crew ripped android party thanks u droid link sxsw,3
"['data', 'crunch', 'sxsw', 'crippling', 'google', 'voice', 'back', 'regular', 'texting', 'go']",Other Google product or service,Negative emotion,,data crunch sxsw crippling google voice back regular texting go,1
"['new', 'product', 'idea', 'pant', 'built', 'iphone', 'charging', 'dock', 'built', 'pocket', 'sxsw']",iPhone,Positive emotion,Apple,new product idea pant built iphone charging dock built pocket sxsw,3
"['trueexpect', 'insidious', 'approach', 'like', 'apple', 'subscription', 'rt', 'user', 'link', 'disgraceful', 'library', 'sxsw']",Apple,Negative emotion,Apple,trueexpect insidious approach like apple subscription rt user link disgraceful library sxsw,1
"['bjdproductions', 'even', 'begin', 'apple', 'win', 'sxsw', 'link', 'tech']",Apple,Positive emotion,Apple,bjdproductions even begin apple win sxsw link tech,3
"['link', 'security', 'guard', 'enjoying', 'ipad2', 'apple', 'store', 'austin', 'sxsw']",iPad,Positive emotion,Apple,link security guard enjoying ipad2 apple store austin sxsw,3
"['unimitated', 'fingerprint', 'security', 'scan', 'link', 'itunes', 'ipad2', '1990style', 'sxsw']",iPad,Positive emotion,Apple,unimitated fingerprint security scan link itunes ipad2 1990style sxsw,3
"['flipboard', 'bldg', 'app', 'appstore', 'need', 'wholistic', 'mktg', 'awareness', 'pr', 'strategy', 'drive', 'adoption', 'rely', 'apple', 'rji', 'sxsw']",none,Negative emotion,none,flipboard bldg app appstore need wholistic mktg awareness pr strategy drive adoption rely apple rji sxsw,1
"['tech', 'ipad', '2', 'get', 'temporary', 'applestore', 'sxsw', 'link']",iPad,Positive emotion,Apple,tech ipad 2 get temporary applestore sxsw link,3
"['also', 'ipad', '2', 'ordered', 'stand', 'line', 'wasting', 'valuable', 'fellowship', 'time', 'sxsw']",iPad,Positive emotion,Apple,also ipad 2 ordered stand line wasting valuable fellowship time sxsw,3
"['discovered', 'new', 'conversation', 'icebreaker', 'quothey', 'new', 'ipad', '2', 'yes', 'isquot', 'sxsw', 'social']",iPad,Positive emotion,Apple,discovered new conversation icebreaker quothey new ipad 2 yes isquot sxsw social,3
"['composed', 'tweet', 'acerbic', 'cynical', 'ipad', 'user', 'phone', 'crashed', 'dumped', 'apps', 'twitterpower', 'sxsw', 'imthatgood']",iPad,Negative emotion,Apple,composed tweet acerbic cynical ipad user phone crashed dumped apps twitterpower sxsw imthatgood,1
"['wish', 'ipad', 'right', 'last', 'longer', 'phone', 'awkward', 'laptop', 'sxsw']",iPad,Positive emotion,Apple,wish ipad right last longer phone awkward laptop sxsw,3
"['could', 'dangerous', 'rt', 'user', 'sweetapple', 'listened', 'u', 'temp', 'apple', 'store', 'near', 'sxsw', 'ipad2', 'launch', 'link']",Apple,Positive emotion,Apple,could dangerous rt user sweetapple listened u temp apple store near sxsw ipad2 launch link,3
"['could', 'first', 'big', 'news', 'sxsw', 'link', 'google', 'building', 'new', 'social', 'framework']",none,Positive emotion,none,could first big news sxsw link google building new social framework,3
"['google', 'bing', 'meet', 'sxsw', 'lover', 'tiff', 'last', 'month', 'seems', 'disappointingly', 'friendly', 'link']",Google,Negative emotion,Google,google bing meet sxsw lover tiff last month seems disappointingly friendly link,1
"['google', 'bing', 'page', 'rank', 'panel', 'ridiculously', 'crowded', 'al', 'franken', 'justin', 'timberlake', 'sxsw', 'link']",Google,Negative emotion,Google,google bing page rank panel ridiculously crowded al franken justin timberlake sxsw link,1
"['unexpected', 'bonus', 'waking', '4am', 'make', 'sxsw', 'flight', 'order', 'ipad', '2', 'right', 'released']",none,Positive emotion,none,unexpected bonus waking 4am make sxsw flight order ipad 2 right released,3
"['near', 'field', 'communication', 'already', 'android', 'phone', 'sxsw', 'bemyneighbor']",none,Positive emotion,none,near field communication already android phone sxsw bemyneighbor,3
"['major', 'ipad', 'design', 'flaw', 'sxsw', 'go', 'ipad', 'app', 'stay', 'open', 'switch', 'apps', 'ipaddesignheadaches', 'sxsw']",iPad or iPhone App,Negative emotion,Apple,major ipad design flaw sxsw go ipad app stay open switch apps ipaddesignheadaches sxsw,1
"['headed', 'sxsw', 'hear', 'talk', 'integrated', 'social', 'network', 'dynamic', 'team', 'synergy', 'got', 'ipad', 'ready', 'go']",iPad,Positive emotion,Apple,headed sxsw hear talk integrated social network dynamic team synergy got ipad ready go,3
"['bored', 'keynote', 'sxsw', 'use', 'ipad', 'draw', 'picture', 'even', 'good', 'artist', 'link', 'sxswi']",iPad,Positive emotion,Apple,bored keynote sxsw use ipad draw picture even good artist link sxswi,3
"['brand', 'focus', 'rt', 'user', 'trust', 'zappos', 'likability', 'virgin', 'product', 'apple', 'recipe', 'success', 'user', 'sxsw']",Apple,Positive emotion,Apple,brand focus rt user trust zappos likability virgin product apple recipe success user sxsw,3
"['brand', 'focus', 'purpose', 'object', 'survive', 'amp', 'succeed', 'google', 'search', 'useful', 'info', 'nike', 'sneaker', 'performance', 'sxsw']",Google,Positive emotion,Google,brand focus purpose object survive amp succeed google search useful info nike sneaker performance sxsw,3
"['unexpected', 'geekout', 'moment', 'sxsw', 'far', 'talked', 'guy', 'bringing', 'traveller', 'rpg', 'iphone']",iPad or iPhone App,Positive emotion,Apple,unexpected geekout moment sxsw far talked guy bringing traveller rpg iphone,3
"['stood', 'line', '30', 'minute', 'buy', '2', 'ipads', 'apple', 'popup', 'store', 'apple', 'sxsw', 'ipad', 'austin', 'fuckyeah']",iPad,Positive emotion,Apple,stood line 30 minute buy 2 ipads apple popup store apple sxsw ipad austin fuckyeah,3
"['sam', 'licked', 'rt', 'user', 'got', 'ipad', '2', 'sxsw', 'link', 'cc', 'user']",iPad,Positive emotion,Apple,sam licked rt user got ipad 2 sxsw link cc user,3
"['added', 'sxsw', 'flight', 'user', 'matching', 'people', 'planesairports', 'also', 'downloaded', 'user', 'iphone', 'app', 'nicely', 'done']",iPad or iPhone App,Positive emotion,Apple,added sxsw flight user matching people planesairports also downloaded user iphone app nicely done,3
"['found', 'new', 'mapquest', 'iphone', 'app', 'turnbyturn', 'gps', 'free', 'time', 'check', 'get', 'reacquainted', 'mq', 'sxsw']",iPad or iPhone App,Positive emotion,Apple,found new mapquest iphone app turnbyturn gps free time check get reacquainted mq sxsw,3
"['probably', 'put', 'away', 'rt', 'user', 'android', 'party', 'kind', 'embarrassed', 'iphone', 'sxsw']",iPhone,Negative emotion,Apple,probably put away rt user android party kind embarrassed iphone sxsw,1
"['make', 'good', 'sense', 'rt', 'user', 'apple', 'set', 'open', 'popup', 'shop', 'core', 'sxsw', 'action', 'link', 'via', 'user', 'sxsw']",Apple,Positive emotion,Apple,make good sense rt user apple set open popup shop core sxsw action link via user sxsw,3
"['uber', 'brand', 'smart', 'going', 'move', 'ton', 'ipad2', 'apple', 'opening', 'popup', 'shop', 'austin', 'sxsw', 'link', 'viauser', 'user']",none,Positive emotion,none,uber brand smart going move ton ipad2 apple opening popup shop austin sxsw link viauser user,3
"['localmind', 'sound', 'awesome', 'location', 'based', 'qampa', 'could', 'incredibly', 'useful', 'link', 'iphone', 'sxsw']",iPhone,Positive emotion,Apple,localmind sound awesome location based qampa could incredibly useful link iphone sxsw,3
"['heard', 'apple', 'opening', 'store', 'downtown', 'austin', 'tomorrow', 'sell', 'ipads', 'sxsw', 'attendee']",Apple,Positive emotion,Apple,heard apple opening store downtown austin tomorrow sell ipads sxsw attendee,3
"['interested', 'hear', 'different', 'google', 'buzz', 'rt', 'user', 'get', 'ready', 'word', 'quotcirclesquot', 'trending', 'sxswi', 'sxsw']",Other Google product or service,Positive emotion,,interested hear different google buzz rt user get ready word quotcirclesquot trending sxswi sxsw,3
"['annoyed', 'sxsw', 'schedule', 'app', 'bad', 'ui', 'ipad', 'finger', 'fat']",iPad or iPhone App,Negative emotion,Apple,annoyed sxsw schedule app bad ui ipad finger fat,1
"['link', 'hear', 'apple\x89ûªs', 'opening', 'temporary', 'store', 'sxsw', 'via', 'user']",Apple,Positive emotion,Apple,link hear appleûªs opening temporary store sxsw via user,3
"['ballroom', 'marissagoogle', 'talking', 'cool', 'project', 'obv', 'love', 'google', 'art', 'project', 'sxsw']",Google,Positive emotion,Google,ballroom marissagoogle talking cool project obv love google art project sxsw,3
"['packed', 'charging', 'ipad', 'busy', 'dayweekend', 'ahead', 'also', 'need', 'download', 'sxsw', 'apps', 'iphoneipad']",iPad or iPhone App,Positive emotion,Apple,packed charging ipad busy dayweekend ahead also need download sxsw apps iphoneipad,3
"['ipad', 'found', 'friend', 'jeff', 'sxsw', 'thanks', 'everyone', 'helped', 'especially', 'user']",iPad,Positive emotion,Apple,ipad found friend jeff sxsw thanks everyone helped especially user,3
"['packed', 'many', 'apple', 'device', 'alarm', 'set', '515am', 'see', 'yall', 'sxsw', 'psyched', 'meet', 'finally', 'many', 'guy']",Apple,Positive emotion,Apple,packed many apple device alarm set 515am see yall sxsw psyched meet finally many guy,3
"['first', 'ipad2', 'sighting', 'sxsw', 'interactive', 'infact', 'everyone', 'least', '1', 'apple', 'product', 'use', 'time']",none,Positive emotion,none,first ipad2 sighting sxsw interactive infact everyone least 1 apple product use time,3
"['want', 'ipad2', 'win', 'link', 'sxsw']",iPad,Positive emotion,Apple,want ipad2 win link sxsw,3
"['download', 'daily', 'grape', 'new', 'app', 'user', 'iphone', 'take', 'wine', 'shop', 'sxsw']",iPad or iPhone App,Positive emotion,Apple,download daily grape new app user iphone take wine shop sxsw,3
"['cobra', 'iradar', 'detection', 'system', 'coming', 'android', 'next', 'month', 'link', 'android', 'gps', 'iphone', 'sxsw']",Android App,Positive emotion,Google,cobra iradar detection system coming android next month link android gps iphone sxsw,3
"['exciting', 'day', 'sxsw', 'day', 'tim', 'ferriss', 'rumor', 'launch', 'google', 'circle', 'later']",Other Google product or service,Positive emotion,,exciting day sxsw day tim ferriss rumor launch google circle later,3
"['pie', 'day', 'google', 'booth', 'sxsw', 'mylunch']",Google,Positive emotion,Google,pie day google booth sxsw mylunch,3
"['forbidden', 'apple', 'spoiled', 'long', 'live', 'samsung', 'rocking', 'sxsw', 'amp', 'sxswis', 'world']",Apple,Negative emotion,Apple,forbidden apple spoiled long live samsung rocking sxsw amp sxswis world,1
"['made', 'decision', 'id', 'like', 'purchase', 'ipad', 'would', 'perfect', 'sxsw']",iPad,Positive emotion,Apple,made decision id like purchase ipad would perfect sxsw,3
"['getting', 'idea', 'sxsw', 'save', 'ipad', 'using', 'action', 'list', 'true', 'gtd', 'syncs', 'w', 'iphone', 'amp', 'web', 'link']",none,Positive emotion,none,getting idea sxsw save ipad using action list true gtd syncs w iphone amp web link,3
"['decided', 'need', 'ipad', 'usguys', 'sxsw']",iPad,Positive emotion,Apple,decided need ipad usguys sxsw,3
"['model', 'one', 'rt', 'user', 'sxsw', 'quotapple', 'come', 'cool', 'tech', 'one', 'ever', 'heard', 'cuz', 'go', 'conferencesquot']",Apple,Positive emotion,Apple,model one rt user sxsw quotapple come cool tech one ever heard cuz go conferencesquot,3
"['great', 'ui', 'demo', 'user', 'user', 'link', 'xoom', 'sxsw', 'android', 'tech', 'tablet']",Android,Positive emotion,Google,great ui demo user user link xoom sxsw android tech tablet,3
"['ipad', 'design', 'panel', 'hilton', 'salon', 'j', 'filling', 'quickly', 'surprise', 'tapworthy', 'sxsw', 'fun', 'ipad2']",iPad,Positive emotion,Apple,ipad design panel hilton salon j filling quickly surprise tapworthy sxsw fun ipad2,3
"['android', 'dev', 'meetup', 'mostly', 'people', 'looking', 'devs', 'good', 'skill', 'learn', 'already', 'sxsw', 'mccannsxsw']",Android,Positive emotion,Google,android dev meetup mostly people looking devs good skill learn already sxsw mccannsxsw,3
"['bit', 'disappointed', 'two', 'ipad', 'talk', 'many', 'overlapping', 'example', 'sxsw']",Apple,Negative emotion,Apple,bit disappointed two ipad talk many overlapping example sxsw,1
"['every', 'dj', 'sxsw', 'spin', 'ipad', 'part', 'arsenal', 'future', 'coming', 'wait']",none,Positive emotion,none,every dj sxsw spin ipad part arsenal future coming wait,3
"['hope', 'jinx', 'user', 'nice', 'user', 'iphone', 'app', 'behaving', 'today', 'crash', 'yesterday', 'ridiculous', 'sxsw']",iPad or iPhone App,Positive emotion,Apple,hope jinx user nice user iphone app behaving today crash yesterday ridiculous sxsw,3
"['thank', 'goodness', 'ran', 'ipad', '2', 'worry', 'giving', 'buying', 'one', 'popup', 'apple', 'store', 'sxsw']",iPad,Positive emotion,Apple,thank goodness ran ipad 2 worry giving buying one popup apple store sxsw,3
"['fest', 'tipdo', 'iphone', 'doucheput', 'away', 'phone', 'talk', 'fellow', 'festgoers', 'line', 'etcall', 'good', 'people', 'love', 'film', 'sxsw']",iPhone,Negative emotion,Apple,fest tipdo iphone doucheput away phone talk fellow festgoers line etcall good people love film sxsw,1
"['drink', 'called', 'alan', 'turing', 'making', 'lego', 'robot', 'oh', 'google', 'sxsw', 'user', 'speakeasy', 'link']",Google,Positive emotion,Google,drink called alan turing making lego robot oh google sxsw user speakeasy link,3
"['apple', 'driving', 'quotconsumerizationquot', 'empowered', 'sxsw']",Apple,Positive emotion,Apple,apple driving quotconsumerizationquot empowered sxsw,3
"['android', 'party', 'kind', 'embarrassed', 'iphone', 'sxsw']",iPhone,Negative emotion,Apple,android party kind embarrassed iphone sxsw,1
"['friend', 'user', 'finally', 'quotput', 'outquot', 'android', 'get', 'app', 'amp', 'get', 'disc', 'sxsw', 'kh']",none,Positive emotion,none,friend user finally quotput outquot android get app amp get disc sxsw kh,3
"['soundsfantastic', 'rt', 'user', 'google', 'partyawesome', 'sxsw']",none,Positive emotion,none,soundsfantastic rt user google partyawesome sxsw,3
"['schedule', 'heavier', 'laptop', 'ipad', 'already', 'sxsw']",iPad,Positive emotion,Apple,schedule heavier laptop ipad already sxsw,3
"['kind', 'giddy', 'theindustryparty', 'google', 'amp', 'gsdm', 'finally', 'fun', 'come', 'u', 'non', 'swsurrogates', 'sxsw', 'notpouting']",Google,Positive emotion,Google,kind giddy theindustryparty google amp gsdm finally fun come u non swsurrogates sxsw notpouting,3
"['google', 'body', 'beta', 'uber', 'sxsw', 'health2dev', 'cool']",Other Google product or service,Positive emotion,,google body beta uber sxsw health2dev cool,3
"['anybody', 'get', 'sxsw', 'mobile', 'apps', 'work', 'downloaded', 'android', 'iphone', 'blackberry', 'get', 'stuck', 'downloading', 'startup']",iPad or iPhone App,Negative emotion,Apple,anybody get sxsw mobile apps work downloaded android iphone blackberry get stuck downloading startup,1
"['already', 'jealous', 'user', 'apple', 'popup', 'store', 'sxsw', 'link', 'gonnagetanipad2']",Apple,Positive emotion,Apple,already jealous user apple popup store sxsw link gonnagetanipad2,3
"['already', 'tell', 'brought', 'as', 'pillow', 'iphone', 'backup', 'charger', 'sxsw', 'numbassonfloor']",iPhone,Positive emotion,Apple,already tell brought as pillow iphone backup charger sxsw numbassonfloor,3
"['find', 'user', 'playing', 'sxsw', 'eventseekr', 'app', 'android', 'got', 'link']",Android App,Positive emotion,Google,find user playing sxsw eventseekr app android got link,3
"['see', 'user', 'quotleft', 'brain', 'search', 'google', 'right', 'brain', 'search', 'xquot', 'panel', 'sxsw', 'bettersearch']",Google,Positive emotion,Google,see user quotleft brain search google right brain search xquot panel sxsw bettersearch,3
"['srsly', 'love', 'user', 'user', 'promo', 'user', 'srsly', 'hate', 'excludes', 'user', 'esp', 'since', 'ipad', 'insists', 'disney', 'sxsw']",iPad,Negative emotion,Apple,srsly love user user promo user srsly hate excludes user esp since ipad insists disney sxsw,1
"['google', 'aclu', 'party', 'tonight', 'sxsw', 'best', 'thing', 'ever', 'apparently', 'spazmatics', 'franchised', 'band', 'rock']",Google,Positive emotion,Google,google aclu party tonight sxsw best thing ever apparently spazmatics franchised band rock,3
