tweet_text,recipient,emotion,brand,lemmatized_review,emotion_code
"['rt', 'user', 'mypov', 'winner', 'popup', 'apple', 'store', 'chevy', 'cruze', 'loser', 'investor', 'propping', 'frothy', 'startup', 'w', 'enterprise', 'strategy', 'sxsw']",Apple,Positive emotion,Apple,rt user mypov winner popup apple store chevy cruze loser investor propping frothy startup w enterprise strategy sxsw,3
"['rt', 'user', 'need', 'workspace', 'book', 'iphone', 'link', 'user', 'app', 'sxsw', 'virtualoffice']",iPad or iPhone App,Positive emotion,Apple,rt user need workspace book iphone link user app sxsw virtualoffice,3
"['rt', 'user', 'new', 'ubersocial', 'iphone', 'app', 'store', 'includes', 'uberguide', 'sxsw', 'sponsored', 'mashable', 'link']",none,Positive emotion,none,rt user new ubersocial iphone app store includes uberguide sxsw sponsored mashable link,3
"['rt', 'user', 'new', 'sxsw', 'rule', 'ooing', 'ahing', 'new', 'ipad', 'get', 'big', 'deal', 'everybody', 'one']",iPad,Negative emotion,Apple,rt user new sxsw rule ooing ahing new ipad get big deal everybody one,1
"['rt', 'user', 'new', 'ubersocial', '4', 'iphone', 'app', 'store', 'includes', 'uberguide', '2', 'sxsw', 'sponsored', 'mashable', 'cont', 'link']",iPad or iPhone App,Positive emotion,Apple,rt user new ubersocial 4 iphone app store includes uberguide 2 sxsw sponsored mashable cont link,3
"['rt', 'user', 'new', 'ubersocial', 'iphone', 'app', 'store', 'includes', 'uberguide', 'sxsw', 'link']",iPad or iPhone App,Positive emotion,Apple,rt user new ubersocial iphone app store includes uberguide sxsw link,3
"['rt', 'user', 'new', 'ubersocial', 'iphone', 'app', 'store', 'includes', 'uberguide', 'sxsw', 'link', 'got']",none,Positive emotion,none,rt user new ubersocial iphone app store includes uberguide sxsw link got,3
"['rt', 'user', 'new', 'ubersocial', 'iphone', 'app', 'store', 'includes', 'uberguide', 'sxsw', 'sponsored', 'mashable', 'link']",iPad or iPhone App,Positive emotion,Apple,rt user new ubersocial iphone app store includes uberguide sxsw sponsored mashable link,3
"['rt', 'user', 'new', 'ubersocial', 'iphone', 'includes', 'uberguide', 'sxsw', 'sponsored', 'mashable', 'link', 'lt', 'v', 'nicely', 'done']",iPad or iPhone App,Positive emotion,Apple,rt user new ubersocial iphone includes uberguide sxsw sponsored mashable link lt v nicely done,3
"['rt', 'user', 'new', 'google', 'tool', 'measuring', 'everything', 'displaying', 'one', 'place', 'almost', 'make', 'cry', 'happy', 'thank', 'bavcid', 'sxsw']",Other Google product or service,Positive emotion,,rt user new google tool measuring everything displaying one place almost make cry happy thank bavcid sxsw,3
"['rt', 'user', 'new', 'ipad', 'apps', 'speech', 'therapy', 'communication', 'showcased', 'sxsw', 'user', 'link']",iPad or iPhone App,Positive emotion,Apple,rt user new ipad apps speech therapy communication showcased sxsw user link,3
"['rt', 'user', 'new', 'ipad', 'apps', 'speech', 'therapy', 'communication', 'showcased', 'sxsw', 'conference', 'link', 'sxswi', 'sxsh', 'sxswh', 'hcsm', 'slp']",iPad or iPhone App,Positive emotion,Apple,rt user new ipad apps speech therapy communication showcased sxsw conference link sxswi sxsh sxswh hcsm slp,3
"['rt', 'user', 'new', 'iphone', 'autocorrect', 'already', 'tried', 'change', 'quotcoworkersquot', 'quotvisigothsquot', 'going', 'long', 'five', 'day', 'sxsw']",iPhone,Negative emotion,Apple,rt user new iphone autocorrect already tried change quotcoworkersquot quotvisigothsquot going long five day sxsw,1
"['rt', 'user', 'new', 'mike', 'tyson', 'game', 'coming', 'iphone', 'link', 'iphone', 'sxsw', 'videogames', 'tyson', 'art', 'cartoon']",iPad or iPhone App,Positive emotion,Apple,rt user new mike tyson game coming iphone link iphone sxsw videogames tyson art cartoon,3
"['rt', 'user', 'new', 'post', 'user', 'iphone', 'app', 'make', 'easy', 'connect', 'social', 'network', 'people', 'meet', 'link', 'sxsw']",iPad or iPhone App,Positive emotion,Apple,rt user new post user iphone app make easy connect social network people meet link sxsw,3
"['rt', 'user', 'new', 'social', 'network', 'may', 'debut', 'sxsw', 'google', 'circle', 'link', 'eatdrinktweet', 'done', 'yet']",none,Positive emotion,none,rt user new social network may debut sxsw google circle link eatdrinktweet done yet,3
"['rt', 'user', 'news', 'ipad', 'go', 'enterprise', 'user', 'say', 'first', 'look', 'new', '\x89ûïview\x89û\x9d', 'app', 'link', 'tip', 'user', 'sxsw']",iPad,Positive emotion,Apple,rt user news ipad go enterprise user say first look new ûïviewû app link tip user sxsw,3
"['rt', 'user', 'nice', 'user', 'told', 'user', 'used', 'brief', 'case', 'study', 'ipad', 'design', 'paradigm', 'panel', 'sxsw']",none,Positive emotion,none,rt user nice user told user used brief case study ipad design paradigm panel sxsw,3
"['rt', 'user', 'nieuwe', 'regel', 'quotgoogle', 'tweetquot', 'new', 'quotthink', 'speakquot', 'mark', 'belinsky', '911tweets', 'panel', 'sxsw']",Google,Positive emotion,Google,rt user nieuwe regel quotgoogle tweetquot new quotthink speakquot mark belinsky 911tweets panel sxsw,3
"['rt', 'user', 'ning', 'amp', 'mobile', 'roadie', 'thrilled', 'offer', 'unofficial', 'sxsw', 'insider', 'guide', 'iphone', 'fun', 'austin', 'link']",none,Positive emotion,none,rt user ning amp mobile roadie thrilled offer unofficial sxsw insider guide iphone fun austin link,3
"['rt', 'user', 'stumbling', 'around', 'lost', 'sxsw', 'stay', 'contact', 'w', 'group', 'w', 'user', 'iphone', 'application', 'link']",iPhone,Positive emotion,Apple,rt user stumbling around lost sxsw stay contact w group w user iphone application link,3
"['rt', 'user', 'waymatt', 'fricking', 'damon', 'google', 'party', 'maggie', 'maes', 'sxsw', 'user', 'link']",Google,Positive emotion,Google,rt user waymatt fricking damon google party maggie maes sxsw user link,3
"['rt', 'user', 'fan', 'new', 'sxsw', 'trend', 'audience', 'sharing', 'opinion', 'via', 'holding', 'ipad', 'listen', 'annoying']",iPad,Negative emotion,Apple,rt user fan new sxsw trend audience sharing opinion via holding ipad listen annoying,1
"['rt', 'user', 'note', 'self', 'downside', 'tweeting', 'white', 'ipad', '2', 'expect', 'mocked', 'user', 'sxsw']",iPad,Negative emotion,Apple,rt user note self downside tweeting white ipad 2 expect mocked user sxsw,1
"['rt', 'user', 'nothing', 'say', 'douche', 'cake', 'like', 'walking', 'around', 'ipad', 'like', 'iphone', 'sxsw']",iPad,Negative emotion,Apple,rt user nothing say douche cake like walking around ipad like iphone sxsw,1
"['rt', 'user', 'novelty', 'ipad', 'news', 'apps', 'fade', 'fast', 'among', 'sxsw', 'delegate', 'user', 'link']",iPad or iPhone App,Negative emotion,Apple,rt user novelty ipad news apps fade fast among sxsw delegate user link,1
"['rt', 'user', '150', 'million', 'mobile', 'google', 'map', 'user', 'user', 'sxsw', 'science']",Google,Positive emotion,Google,rt user 150 million mobile google map user user sxsw science,3
"['rt', 'user', 'nyt', 'app', 'ipad', 'quothere', 'amazing', 'way', 'serve', 'readershipquot', 'quothere', 'market', 'opportunity', 'ignorequot', 'sxsw', 'newsapps']",iPad or iPhone App,Positive emotion,Apple,rt user nyt app ipad quothere amazing way serve readershipquot quothere market opportunity ignorequot sxsw newsapps,3
"['new', 'version', 'google', 'map', 'mobile', 'pretty', 'amazing', 'vector', 'based', 'amp', 'fast', 'sxsw']",Other Google product or service,Positive emotion,,new version google map mobile pretty amazing vector based amp fast sxsw,3
"['rt', 'user', 'offered', 'sxsw', 'ipad', 'promo', 'ninjafinder', 'user', 'fan', 'sxsw', 'suck', 'sxsw']",none,Positive emotion,none,rt user offered sxsw ipad promo ninjafinder user fan sxsw suck sxsw,3
"['rt', 'user', 'oh', 'god', 'rt', 'user', 'rumor', 'apple', 'opening', 'temp', 'store', 'austin', 'sxsw', 'ampipad', '2', 'launch', 'link']",Apple,Positive emotion,Apple,rt user oh god rt user rumor apple opening temp store austin sxsw ampipad 2 launch link,3
"['rt', 'user', 'oh', 'god', 'rt', 'user', 'rumor', 'apple', 'opening', 'temporary', 'store', 'downtown', 'austin', 'sxsw', 'ampipad', '2', 'launch', 'link']",Apple,Positive emotion,Apple,rt user oh god rt user rumor apple opening temporary store downtown austin sxsw ampipad 2 launch link,3
"['rt', 'user', 'oh', 'quotlike', 'believe', 'three', 'boyfriend', 'since', 'first', 'ipad', 'quot', 'sxsw']",none,Positive emotion,none,rt user oh quotlike believe three boyfriend since first ipad quot sxsw,3
"['rt', 'user', 'average', 'google', 'map', 'see', '40', 'user', 'come', 'mobile', 'device', 'becoming', 'connected', 'user', 'sxsw', 'donline', 'dk']",Other Google product or service,Positive emotion,,rt user average google map see 40 user come mobile device becoming connected user sxsw donline dk,3
"['rt', 'user', 'second', 'day', 'business', 'apple', 'popup', 'store', 'appears', 'trending', 'sxsw', 'vb', 'user', 'apple', 'store', 'sxsw', 'pic', 'link']",Apple,Positive emotion,Apple,rt user second day business apple popup store appears trending sxsw vb user apple store sxsw pic link,3
"['rt', 'user', 'early', 'nerdbird', 'sxsw', 'get', 'user', 'iphone', 'app', 'share', 'photo', 'airport', 'people', 'like', 'people', 'walmart', 'airport']",iPad or iPhone App,Positive emotion,Apple,rt user early nerdbird sxsw get user iphone app share photo airport people like people walmart airport,3
"['rt', 'user', 'airline', 'mentioned', 'guy', 'kawasaki', 'delightful', 'like', 'apple', 'drumroll', 'user', 'congrats', 'sxsw']",Apple,Positive emotion,Apple,rt user airline mentioned guy kawasaki delightful like apple drumroll user congrats sxsw,3
"['rt', 'user', 'sxsw', 'quotmy', 'iphone', 'tell', 'know', 'mean', 'winningquot', 'user']",iPhone,Positive emotion,Apple,rt user sxsw quotmy iphone tell know mean winningquot user,3
"['rt', 'user', 'oo', 'apple', 'rumored', 'opening', 'temporary', 'store', 'sxsw', 'link']",Apple,Positive emotion,Apple,rt user oo apple rumored opening temporary store sxsw link,3
"['rt', 'user', 'sxsw', 'app', 'android', 'huge', 'prop', 'user', 'user', 'user', 'amp', 'user', 'get', 'link']",Android App,Positive emotion,Google,rt user sxsw app android huge prop user user user amp user get link,3
"['rt', 'user', 'updated', 'iphone', 'app', 'song', 'info', 'select', 'stream', 'incl', 'user', '247', 'amp', 'live', 'video', 'streaming', 'time', 'sxsw', 'link']",iPad or iPhone App,Positive emotion,Apple,rt user updated iphone app song info select stream incl user 247 amp live video streaming time sxsw link,3
"['rt', 'user', '300', 'people', 'line', 'apple', 'store', 'downtown', 'austin', 'ipad2', 'sxsw']",Apple,Positive emotion,Apple,rt user 300 people line apple store downtown austin ipad2 sxsw,3
"['rt', 'user', '40', 'use', 'google', 'map', 'mobile', 'marissa', 'mayer', 'sxsw', 'lt', 'use', 'time', 'suxsw']",Google,Positive emotion,Google,rt user 40 use google map mobile marissa mayer sxsw lt use time suxsw,3
"['rt', 'user', 'p', 'user', 'google', 'throw', 'btchin', 'party', 'shout', 'spazmatics', 'sxsw']",Google,Positive emotion,Google,rt user p user google throw btchin party shout spazmatics sxsw,3
"['rt', 'user', 'panel', 'got', 'head', 'ipad', 'saying', 'quotlink', 'loud', 'newsapps', 'sxsw']",iPad,Positive emotion,Apple,rt user panel got head ipad saying quotlink loud newsapps sxsw,3
"['rt', 'user', 'papa', 'sangre', 'immersive', 'audio', 'game', 'iphone', 'free', 'today', 'highly', 'recommended', 'papasangre', 'sxsw']",iPad or iPhone App,Positive emotion,Apple,rt user papa sangre immersive audio game iphone free today highly recommended papasangre sxsw,3
"['rt', 'user', 'part', 'journalsim', 'support', 'democracy', 'yes', 'informed', 'populous', 'yes', 'ipad', 'focus', 'support', 'newsapps', 'sxsw']",none,Negative emotion,none,rt user part journalsim support democracy yes informed populous yes ipad focus support newsapps sxsw,1
"['rt', 'user', 'partying', 'android', 'user', 'sxsw', 'user', 'lustre', 'pearl', 'link']",Android,Positive emotion,Google,rt user partying android user sxsw user lustre pearl link,3
"['rt', 'user', 'per', 'rumor', 'google', 'may', 'preview', 'big', 'social', 'strategy', '80sthemed', 'costume', 'party', 'sxsw', 'yep', 'link', 'cnet']",Google,Positive emotion,Google,rt user per rumor google may preview big social strategy 80sthemed costume party sxsw yep link cnet,3
"['rt', 'user', 'perfect', 'sxsw', 'iphone', 'app', 'home', 'screen', 'organization', 'link', 'like']",iPad or iPhone App,Positive emotion,Apple,rt user perfect sxsw iphone app home screen organization link like,3
"['rt', 'user', 'pic', 'ipadwinning', 'performance', 'link', 'sxsw', 'accordion', 'toodamnlucky']",iPad,Positive emotion,Apple,rt user pic ipadwinning performance link sxsw accordion toodamnlucky,3
"['rt', 'user', 'playing', 'fave', 'new', 'iphone', 'app', 'user', 'wow', 'rock', 'sxsw', 'next', 'week']",iPad or iPhone App,Positive emotion,Apple,rt user playing fave new iphone app user wow rock sxsw next week,3
"['rt', 'user', 'poor', 'austin', 'rt', 'user', 'ipad', '2', 'launch', 'coincides', 'fri', 'afternoon', 'sxsw', 'apple', 'store', 'employee', 'austin', 'may', 'begin', 'weeping']",iPad,Positive emotion,Apple,rt user poor austin rt user ipad 2 launch coincides fri afternoon sxsw apple store employee austin may begin weeping,3
"['rt', 'user', 'preparing', 'sxsw', 'talk', 'google', 'doodle', 'user', 'fun', 'friday', '5pm', 'link']",Other Google product or service,Positive emotion,,rt user preparing sxsw talk google doodle user fun friday 5pm link,3
"['rt', 'user', 'qrafter', 'better', 'paid', 'free', 'qr', 'code', 'apps', 'scan', 'vcards', 'also', 'download', 'qrcode', 'iphone', 'sxsw']",iPad or iPhone App,Positive emotion,Apple,rt user qrafter better paid free qr code apps scan vcards also download qrcode iphone sxsw,3
"['rt', 'user', 'questioner', 'sxsw', 'said', 'quotthanks', 'big', 'fanquot', 'google', 'user', 'caused', 'giggle', 'audience', 'laugh']",Google,Positive emotion,Google,rt user questioner sxsw said quotthanks big fanquot google user caused giggle audience laugh,3
"['rt', 'user', 'really', 'finding', 'enjoying', 'ipad', 'design', 'principle', 'well', 'done', 'tapworthy', 'useful', 'clear', 'point', 'throughout', 'sxsw']",iPad,Positive emotion,Apple,rt user really finding enjoying ipad design principle well done tapworthy useful clear point throughout sxsw,3
"['rt', 'user', 'retrollect', 'also', 'android', 'market', 'sxsw']",Android App,Positive emotion,Google,rt user retrollect also android market sxsw,3
"['rt', 'user', 'robot', 'war', 'steampunk', 'time', 'machine', 'mystery', 'box', 'electronics', 'awesome', 'austin', 'taco', 'super', 'happy', 'dev', 'house', 'google', 'win', 'sxsw']",Google,Positive emotion,Google,rt user robot war steampunk time machine mystery box electronics awesome austin taco super happy dev house google win sxsw,3
"['rt', 'user', 'rt', 'user', 'user', 'launch', 'major', 'new', 'social', 'network', 'called', 'circle', 'possibly', 'today', 'link', 'sxsw', 'smm', 'gtgtreally', 'google']",Google,Negative emotion,Google,rt user rt user user launch major new social network called circle possibly today link sxsw smm gtgtreally google,1
"['rt', 'user', 'rt', 'user', 'apple', 'opening', 'popup', 'store', 'austin', 'sxsw', 'link', 'exactly', 'wanted']",Apple,Positive emotion,Apple,rt user rt user apple opening popup store austin sxsw link exactly wanted,3
"['rt', 'user', 'rt', 'user', 'rt', 'user', 'quotgoogle', 'tweetquot', 'new', 'quotthink', 'speakquot', 'mark', 'belinsky', '911tweets', 'panel', 'sxsw']",Google,Positive emotion,Google,rt user rt user rt user quotgoogle tweetquot new quotthink speakquot mark belinsky 911tweets panel sxsw,3
"['rt', 'user', 'rt', 'user', 'user', 'putting', 'gun', 'user', 'head', 'give', 'iphone', 'sxsw', 'link']",iPhone,Positive emotion,Apple,rt user rt user user putting gun user head give iphone sxsw link,3
"['rt', 'user', 'rt', 'user', 'apple', 'set', 'open', 'popup', 'shop', 'core', 'sxsw', 'action', 'link', 'via', 'user']",none,Positive emotion,none,rt user rt user apple set open popup shop core sxsw action link via user,3
"['rt', 'user', 'rt', 'user', 'sxsw', 'google', 'launch', 'major', 'new', 'social', 'network', 'called', 'circle', 'possibly', 'today', 'user', 'link']",Other Google product or service,Positive emotion,,rt user rt user sxsw google launch major new social network called circle possibly today user link,3
"['rt', 'user', 'rt', 'user', 'apple', 'quotthe', 'classiest', 'fascist', 'company', 'americaquot', 'say', 'user', 'sxsw']",Apple,Negative emotion,Apple,rt user rt user apple quotthe classiest fascist company americaquot say user sxsw,1
"['rt', 'user', 'rt', 'user', 'beautiful', 'day', 'austin', 'come', 'grab', 'slice', 'two', 'check', 'google', 'get', 'deal', 'sxswi', 'sxsw']",Google,Positive emotion,Google,rt user rt user beautiful day austin come grab slice two check google get deal sxswi sxsw,3
"['rt', 'user', 'rt', 'user', 'best', 'thing', 'heard', 'weekend', 'sxsw', 'quoti', 'gave', 'ipad', '2', 'money', 'japan', 'relief', 'need', 'ipad']",iPad,Positive emotion,Apple,rt user rt user best thing heard weekend sxsw quoti gave ipad 2 money japan relief need ipad,3
"['rt', 'user', 'rt', 'user', 'forward', 'delicious', 'tmobile', '4g', 'austin', 'iphone', 'user', 'struggle', 'anything', 'sxsw']",iPhone,Negative emotion,Apple,rt user rt user forward delicious tmobile 4g austin iphone user struggle anything sxsw,1
"['rt', 'user', 'rt', 'user', 'google', 'launch', 'social', 'network', 'circle', 'sxsw', 'link', 'excited']",Google,Positive emotion,Google,rt user rt user google launch social network circle sxsw link excited,3
"['rt', 'user', 'rt', 'user', 'google', 'launch', 'major', 'new', 'social', 'network', 'called', 'circle', 'link', 'sxsw', 'nptech']",Other Google product or service,Positive emotion,,rt user rt user google launch major new social network called circle link sxsw nptech,3
"['rt', 'user', 'rt', 'user', 'google', 'launch', 'major', 'new', 'social', 'network', 'called', 'circle', 'possibly', 'today', 'link', 'sxsw', 'via', 'user', 'pcbuzz']",Other Google product or service,Positive emotion,,rt user rt user google launch major new social network called circle possibly today link sxsw via user pcbuzz,3
"['rt', 'user', 'rt', 'user', 'google', 'launch', 'major', 'new', 'social', 'network', 'called', 'circle', 'possibly', 'today', 'link', 'sxsw', 'intrestin']",Other Google product or service,Positive emotion,,rt user rt user google launch major new social network called circle possibly today link sxsw intrestin,3
"['rt', 'user', 'rt', 'user', 'hanging', 'user', 'user', 'google', 'industry', 'partygood', 'crowd', 'sxsw']",Google,Positive emotion,Google,rt user rt user hanging user user google industry partygood crowd sxsw,3
"['rt', 'user', 'rt', 'user', 'heard', 'apple', 'popup', 'store', 'downtown', 'austin', 'pic', 'already', 'gowalla', 'link', 'sxsw', 'poppop']",Apple,Positive emotion,Apple,rt user rt user heard apple popup store downtown austin pic already gowalla link sxsw poppop,3
"['rt', 'user', 'rt', 'user', 'next', 'life', 'coming', 'back', 'ipad', '2', 'woman', 'keep', 'hand', 'thing', 'sxsw']",iPad,Positive emotion,Apple,rt user rt user next life coming back ipad 2 woman keep hand thing sxsw,3
"['rt', 'user', 'rt', 'user', 'rumor', 'apple', 'opening', 'temporary', 'store', 'downtown', 'austin', 'sxsw', 'ipad2', 'launch', 'link']",Apple,Positive emotion,Apple,rt user rt user rumor apple opening temporary store downtown austin sxsw ipad2 launch link,3
"['rt', 'user', 'rt', 'user', 'rumor', 'apple', 'opening', 'temporary', 'store', 'downtown', 'austin', 'sxsw', 'ipad', '2', 'launch', 'link']",Apple,Positive emotion,Apple,rt user rt user rumor apple opening temporary store downtown austin sxsw ipad 2 launch link,3
"['rt', 'user', 'rt', 'user', 'talked', 'mike', 'tyson', 'sxsw', 'new', 'iphone', 'game', 'let', 'u', 'fight', 'pauly', 'celebs', 'link']",iPad or iPhone App,Positive emotion,Apple,rt user rt user talked mike tyson sxsw new iphone game let u fight pauly celebs link,3
"['rt', 'user', 'rt', 'user', 'love', 'user', 'sxsw', 'quotapple', 'come', 'cool', 'technology', 'one', 'ever', 'heard', 'go', 'conferencesquot']",Apple,Positive emotion,Apple,rt user rt user love user sxsw quotapple come cool technology one ever heard go conferencesquot,3
"['rt', 'user', 'rt', 'user', 'love', 'user', 'sxsw', 'quotapple', 'come', 'cool', 'technology', 'one', 'ever', 'heard', 'go', 'conferencesquot']",Apple,Positive emotion,Apple,rt user rt user love user sxsw quotapple come cool technology one ever heard go conferencesquot,3
"['rt', 'user', 'rt', 'user', 'mayer', 'think', 'simplicity', 'lot', 'google', 'developing', 'product', 'sxsw', 'jr']",none,Positive emotion,none,rt user rt user mayer think simplicity lot google developing product sxsw jr,3
"['rt', 'user', 'rt', 'user', 'new', 'ubersocial', 'iphone', 'app', 'store', 'includes', 'uberguide', 'sxsw', 'sponsored', 'mashable', 'link']",iPad or iPhone App,Positive emotion,Apple,rt user rt user new ubersocial iphone app store includes uberguide sxsw sponsored mashable link,3
"['rt', 'user', 'rt', 'user', 'new', 'google', 'tool', 'measuring', 'everything', 'displaying', 'one', 'place', 'almost', 'make', 'cry', 'happy', 'thank', 'bavcid', 'sxsw']",Other Google product or service,Positive emotion,,rt user rt user new google tool measuring everything displaying one place almost make cry happy thank bavcid sxsw,3
"['rt', 'user', 'rt', 'user', 'per', 'rumor', 'google', 'may', 'preview', 'big', 'social', 'strategy', '80sthemed', 'costume', 'party', 'sxsw', 'yep', 'link', 'cn']",none,Positive emotion,none,rt user rt user per rumor google may preview big social strategy 80sthemed costume party sxsw yep link cn,3
"['rt', 'user', 'rt', 'user', 'rt', 'user', 'google', 'launch', 'major', 'new', 'social', 'network', 'called', 'circle', 'possibly', 'today', 'link', 'sxsw', 'cool']",Other Google product or service,Positive emotion,,rt user rt user rt user google launch major new social network called circle possibly today link sxsw cool,3
"['rt', 'user', 'rt', 'user', 'shiny', 'new', 'user', 'user', 'user', 'apps', 'new', 'user', 'book', 'popup', 'ipad', '2', 'store', 'sxsw', 'christmas', 'nerd']",none,Positive emotion,none,rt user rt user shiny new user user user apps new user book popup ipad 2 store sxsw christmas nerd,3
"['rt', 'user', 'rt', 'user', 'sound', 'voice', 'shot', 'exploiting', 'apple', 'amp', 'best', 'buy', '14day', 'return', 'policy', 'imacs', 'brilliant', 'sxsw']",Apple,Negative emotion,Apple,rt user rt user sound voice shot exploiting apple amp best buy 14day return policy imacs brilliant sxsw,1
"['rt', 'user', 'rt', 'user', 'texas', 'observer', 'tomlinson', 'say', 'would', 'double', 'revenue', 'per', 'issue', 'ipad', 'subscription', 'newsapps', 'sxsw']",iPad,Positive emotion,Apple,rt user rt user texas observer tomlinson say would double revenue per issue ipad subscription newsapps sxsw,3
"['rt', 'user', 'rt', 'user', 'day', 'bank', 'america', 'launched', 'iphone', 'app', 'got', '250k', 'new', 'customer', 'bankinnovation', 'sxsw']",iPad or iPhone App,Positive emotion,Apple,rt user rt user day bank america launched iphone app got 250k new customer bankinnovation sxsw,3
"['rt', 'user', 'rt', 'user', 'ipad', '2', 'take', 'sxsw', 'video', 'link']",iPad,Positive emotion,Apple,rt user rt user ipad 2 take sxsw video link,3
"['rt', 'user', 'rt', 'user', 'giving', 'away', 'ipad', '2', 'kick', 'time', 'sxsw', 'visit', 'fb', 'page', 'info', 'link']",iPad,Positive emotion,Apple,rt user rt user giving away ipad 2 kick time sxsw visit fb page info link,3
"['rt', 'user', 'rt', 'user', 'lose', 'hour', 'tonight', 'sxsw', 'attendee', 'blame', 'microsoft', 'apple', 'get', 'credit', 'fixing', 'christmas']",Apple,Positive emotion,Apple,rt user rt user lose hour tonight sxsw attendee blame microsoft apple get credit fixing christmas,3
"['rt', 'user', 'rt', 'user', 'officially', 'sxsw', 'come', 'user', 'grill', 'mention', 'u', 'w', 'zazzlsxsw', 'you\x89ûªll', 'get', 'make', 'iphone', 'case']",Other Apple product or service,Positive emotion,Apple,rt user rt user officially sxsw come user grill mention u w zazzlsxsw youûªll get make iphone case,3
"['rt', 'user', 'rt', 'user', 'yes', 'updated', 'iphone', 'app', 'song', 'info', 'user', '247', 'stream', 'others', 'also', 'live', 'video', 'streaming', 'sxsw', 'link']",iPad or iPhone App,Positive emotion,Apple,rt user rt user yes updated iphone app song info user 247 stream others also live video streaming sxsw link,3
"['rt', 'user', 'rt', 'haha', 'awesomely', 'rad', 'ipad', 'app', 'user', 'link', 'hollergram', 'sxsw', 'via', 'user', 'user']",iPad or iPhone App,Positive emotion,Apple,rt user rt haha awesomely rad ipad app user link hollergram sxsw via user user,3
"['rt', 'user', 'rt', 'user', '150', 'million', 'mobile', 'user', 'google', 'map', '40', 'google', 'map', 'usage', 'mobile', 'device', 'map', 'sxsw']",none,Positive emotion,none,rt user rt user 150 million mobile user google map 40 google map usage mobile device map sxsw,3
"['rt', 'user', 'rt', 'rumor', 'apple', 'opening', 'temporary', 'store', 'downtown', 'austin', 'sxsw', 'ipad', '2', 'launch', 'link']",Apple,Positive emotion,Apple,rt user rt rumor apple opening temporary store downtown austin sxsw ipad 2 launch link,3
"['rt', 'user', 'rtuser', 'love', 'user', 'sxsw', 'quotapple', 'come', 'cool', 'technology', 'one', 'ever', 'heard', 'go', 'conferencesquot']",Apple,Positive emotion,Apple,rt user rtuser love user sxsw quotapple come cool technology one ever heard go conferencesquot,3
"['rt', 'user', 'rumor', 'google', 'launching', 'new', 'social', 'network', 'called', 'circle', 'today', 'sxswi', 'sxsw', 'link']",Google,Positive emotion,Google,rt user rumor google launching new social network called circle today sxswi sxsw link,3
