tweet_text,recipient,emotion,brand,lemmatized_review,emotion_code
"['user', '3g', 'iphone', '3', 'hr', 'tweeting', 'riseaustin', 'dead', 'need', 'upgrade', 'plugin', 'station', 'sxsw']",iPhone,Negative emotion,Apple,user 3g iphone 3 hr tweeting riseaustin dead need upgrade plugin station sxsw,1
"['user', 'know', 'user', 'awesome', 'ipadiphone', 'app', 'likely', 'appreciate', 'design', 'also', 'giving', 'free', 't', 'sxsw']",iPad or iPhone App,Positive emotion,Apple,user know user awesome ipadiphone app likely appreciate design also giving free t sxsw,3
"['user', 'wait', 'ipad', '2', 'also', 'sale', 'sxsw']",iPad,Positive emotion,Apple,user wait ipad 2 also sale sxsw,3
"['user', 'hope', 'year', 'festival', 'crashy', 'year', 'iphone', 'app', 'sxsw']",iPad or iPhone App,Negative emotion,Apple,user hope year festival crashy year iphone app sxsw,1
"['user', 'great', 'stuff', 'fri', 'sxsw', 'marissa', 'mayer', 'google', 'tim', 'oreilly', 'tech', 'booksconferences', 'amp', 'matt', 'mullenweg', 'wordpress']",Google,Positive emotion,Google,user great stuff fri sxsw marissa mayer google tim oreilly tech booksconferences amp matt mullenweg wordpress,3
"['sxsw', 'starting', 'ctia', 'around', 'corner', 'googleio', 'hop', 'skip', 'jump', 'good', 'time', 'android', 'fan']",Android,Positive emotion,Google,sxsw starting ctia around corner googleio hop skip jump good time android fan,3
"['beautifully', 'smart', 'simple', 'idea', 'rt', 'user', 'user', 'wrote', 'hollergram', 'ipad', 'app', 'sxsw']",iPad or iPhone App,Positive emotion,Apple,beautifully smart simple idea rt user user wrote hollergram ipad app sxsw,3
"['counting', 'day', 'sxsw', 'plus', 'strong', 'canadian', 'dollar', 'mean', 'stock', 'apple', 'gear']",Apple,Positive emotion,Apple,counting day sxsw plus strong canadian dollar mean stock apple gear,3
"['excited', 'meet', 'user', 'sxsw', 'show', 'sprint', 'galaxy', 'still', 'running', 'android', '21', 'fail']",Android,Positive emotion,Google,excited meet user sxsw show sprint galaxy still running android 21 fail,3
"['find', 'amp', 'start', 'impromptu', 'party', 'sxsw', 'user', 'wait', 'til', 'android', 'app', 'come']",Android App,Positive emotion,Google,find amp start impromptu party sxsw user wait til android app come,3
"['foursquare', 'ups', 'game', 'time', 'sxsw', 'still', 'prefer', 'user', 'far', 'best', 'looking', 'android', 'app', 'date']",Android App,Positive emotion,Google,foursquare ups game time sxsw still prefer user far best looking android app date,3
"['got', 'love', 'sxsw', 'google', 'calendar', 'featuring', 'top', 'party', 'show', 'case', 'check', 'rt', 'user', 'via', 'user', 'gt']",Other Google product or service,Positive emotion,,got love sxsw google calendar featuring top party show case check rt user via user gt,3
"['great', 'sxsw', 'ipad', 'app', 'user']",iPad or iPhone App,Positive emotion,Apple,great sxsw ipad app user,3
"['haha', 'awesomely', 'rad', 'ipad', 'app', 'user', 'hollergram', 'sxsw']",iPad or iPhone App,Positive emotion,Apple,haha awesomely rad ipad app user hollergram sxsw,3
"['noticed', 'dst', 'coming', 'weekend', 'many', 'iphone', 'user', 'hour', 'late', 'sxsw', 'come', 'sunday', 'morning', 'sxsw', 'iphone']",iPhone,Negative emotion,Apple,noticed dst coming weekend many iphone user hour late sxsw come sunday morning sxsw iphone,1
"['added', 'sxsw', 'flight', 'user', 'matching', 'people', 'planesairports', 'also', 'downloaded', 'user', 'iphone', 'app', 'nicely', 'done']",iPad or iPhone App,Positive emotion,Apple,added sxsw flight user matching people planesairports also downloaded user iphone app nicely done,3
"['must', 'sxsw', 'app', 'rt', 'user', 'lovely', 'review', 'forbes', 'sxsw', 'ipad', 'app', 'holler', 'gram']",iPad or iPhone App,Positive emotion,Apple,must sxsw app rt user lovely review forbes sxsw ipad app holler gram,3
"['need', 'buy', 'ipad2', 'austin', 'sxsw', 'sure', 'need', 'q', 'austin', 'apple', 'store']",iPad,Positive emotion,Apple,need buy ipad2 austin sxsw sure need q austin apple store,3
"['oh', 'god', 'sxsw', 'app', 'ipad', 'pure', 'unadulterated', 'awesome', 'easier', 'browse', 'event', 'ipad', 'website']",iPad or iPhone App,Positive emotion,Apple,oh god sxsw app ipad pure unadulterated awesome easier browse event ipad website,3
"['okay', 'really', 'yay', 'new', 'user', 'android', 'app11', 'kthxbai', 'sxsw']",Android App,Positive emotion,Google,okay really yay new user android app11 kthxbai sxsw,3
"['photo', 'installed', 'sxsw', 'iphone', 'app', 'really', 'nice']",iPad or iPhone App,Positive emotion,Apple,photo installed sxsw iphone app really nice,3
"['really', 'enjoying', 'change', 'gowalla', '30', 'android', 'looking', 'forward', 'seeing', 'else', 'amp', 'foursquare', 'sleeve', 'sxsw']",Android App,Positive emotion,Google,really enjoying change gowalla 30 android looking forward seeing else amp foursquare sleeve sxsw,3
"['rt', 'user', 'looking', 'forward', 'smcdallas', 'pre', 'sxsw', 'party', 'wed', 'hoping', 'win', 'ipad', 'resulting', 'shameless', 'promotion', 'chevysmc']",iPad,Positive emotion,Apple,rt user looking forward smcdallas pre sxsw party wed hoping win ipad resulting shameless promotion chevysmc,3
"['rt', 'haha', 'awesomely', 'rad', 'ipad', 'app', 'user', 'hollergram', 'sxsw', 'via', 'user']",iPad or iPhone App,Positive emotion,Apple,rt haha awesomely rad ipad app user hollergram sxsw via user,3
"['someone', 'started', 'austin', 'user', 'group', 'google', 'group', 'presxsw', 'great', 'idea']",Other Google product or service,Positive emotion,,someone started austin user group google group presxsw great idea,3
"['new', '4sq3', 'look', 'like', 'going', 'rock', 'update', 'iphone', 'android', 'push', 'tonight', 'sxsw', 'keepaustinweird']",iPad or iPhone App,Positive emotion,Apple,new 4sq3 look like going rock update iphone android push tonight sxsw keepaustinweird,3
"['right', 'user', '3', 'app', 'android', 'sweet', 'nice', 'job', 'team', 'sxsw']",Android App,Positive emotion,Google,right user 3 app android sweet nice job team sxsw,3
"['smart', 'user', 'hollergram', 'ipad', 'app', 'sxsw', 'may', 'leave', 'vuvuzela', 'home']",iPad or iPhone App,Positive emotion,Apple,smart user hollergram ipad app sxsw may leave vuvuzela home,3
"['must', 'app', 'ipad', 'going', 'sxsw', 'hollergram']",iPad or iPhone App,Positive emotion,Apple,must app ipad going sxsw hollergram,3
"['best', 'rt', 'user', 'ha', 'first', 'line', 'ipad2', 'sxsw', 'quotpopupquot', 'apple', 'store', 'event', 'planner', 'eventprofs', 'pcma', 'engage365']",iPad,Positive emotion,Apple,best rt user ha first line ipad2 sxsw quotpopupquot apple store event planner eventprofs pcma engage365,3
"['user', 'false', 'alarm', 'google', 'circle', 'coming', 'now\x89ûòand', 'probably', 'ever', 'link', 'google', 'circle', 'social', 'sxsw']",Google,Negative emotion,Google,user false alarm google circle coming nowûòand probably ever link google circle social sxsw,1
"['user', 'great', 'weather', 'greet', 'sxsw', 'still', 'need', 'sweater', 'nightapple', 'putting', 'quotflash', 'storequot', 'downtown', 'sell', 'ipad2']",Apple,Positive emotion,Apple,user great weather greet sxsw still need sweater nightapple putting quotflash storequot downtown sell ipad2,3
"['ipad2', '\x89û÷smartcover\x89ûª', 'open', 'instant', 'access', 'waited', 'get', 'one', 'link', 'apple', 'sxsw']",iPad or iPhone App,Positive emotion,Apple,ipad2 û÷smartcoverûª open instant access waited get one link apple sxsw,3
"['handheld', '\x89û÷hobo\x89ûª', 'drafthouse', 'launch', '\x89û÷hobo', 'shotgun\x89ûª', 'iphone', 'app', 'sxsw', 'link']",none,Positive emotion,none,handheld û÷hoboûª drafthouse launch û÷hobo shotgunûª iphone app sxsw link,3
"['hooray', 'rt', '\x89ûïuser', 'apple', 'opening', 'popup', 'store', 'austin', 'sxsw', 'user', 'link']",Apple,Positive emotion,Apple,hooray rt ûïuser apple opening popup store austin sxsw user link,3
"['woo', '\x89ûïuser', 'apple', 'store', 'downtown', 'austin', 'open', 'til', 'midnight', 'sxsw\x89û\x9d']",Apple,Positive emotion,Apple,woo ûïuser apple store downtown austin open til midnight sxswû,3
"['\x89ûïuser', 'user', 'talking', 'link', 'google', 'effort', 'allow', 'user', 'open', 'system', 'bettercloud', 'sxsw\x89û\x9d']",Google,Positive emotion,Google,ûïuser user talking link google effort allow user open system bettercloud sxswû,3
"['link', 'rt', 'user', '1st', 'stop', 'sxsw', 'chaos', 'amp', 'user', 'hunt', 'austin', 'java', 'get', 'spy', 'game', '4', 'chance', '2', 'win', 'ipad']",iPad,Positive emotion,Apple,link rt user 1st stop sxsw chaos amp user hunt austin java get spy game 4 chance 2 win ipad,3
"['omfg', 'rt', 'user', 'heard', 'apple', 'popup', 'store', 'downtown', 'austin', 'pic', 'already', 'gowalla', 'link', 'sxsw', 'ipad2']",Apple,Positive emotion,Apple,omfg rt user heard apple popup store downtown austin pic already gowalla link sxsw ipad2,3
"['rt', 'user', 'line', 'apple', 'store', 'insane', 'sxsw']",none,Negative emotion,none,rt user line apple store insane sxsw,1
"['attending', 'user', 'ipad', 'design', 'headache', 'sxsw', 'link']",iPad,Negative emotion,Apple,attending user ipad design headache sxsw link,1
"['boo', 'rt', 'user', 'flipboard', 'developing', 'iphone', 'version', 'android', 'say', 'user', 'sxsw']",none,Negative emotion,none,boo rt user flipboard developing iphone version android say user sxsw,1
"['check', 'user', 'user', 'amp', 'user', 'line', 'ipad', '2', 'austin', 'power', 'sxswi', 'sxsw', 'link']",iPad,Positive emotion,Apple,check user user amp user line ipad 2 austin power sxswi sxsw link,3
"['rt', 'user', 'come', 'party', 'w', 'google', 'tonight', 'sxsw', 'link', 'band', 'food', 'art', 'ice', 'cream', 'nifty', 'interactive', 'map']",Google,Positive emotion,Google,rt user come party w google tonight sxsw link band food art ice cream nifty interactive map,3
"['holla', 'rt', 'user', 'google', 'party', 'best', 'ever', 'get', 'butt', 'sxsw']",Google,Positive emotion,Google,holla rt user google party best ever get butt sxsw,3
"['love', 'user', 'iphone', 'case', 'sxsw', 'get', 'phone', 'fail']",iPhone,Positive emotion,Apple,love user iphone case sxsw get phone fail,3
"['new', 'post', 'user', 'iphone', 'app', 'make', 'easy', 'connect', 'social', 'network', 'people', 'meet', 'link', 'sxsw']",iPad or iPhone App,Positive emotion,Apple,new post user iphone app make easy connect social network people meet link sxsw,3
"['nice', 'user', 'iphone', 'app', 'behaving', 'today', 'crash', 'yesterday', 'ridiculous', 'sxsw']",iPad or iPhone App,Positive emotion,Apple,nice user iphone app behaving today crash yesterday ridiculous sxsw,3
"['nice', 'rt', 'user', 'hey', 'apple', 'fan', 'get', 'peek', 'space', 'slated', 'popup', 'sxsw', 'apple', 'store', 'tomorrow', 'link']",Apple,Positive emotion,Apple,nice rt user hey apple fan get peek space slated popup sxsw apple store tomorrow link,3
"['one', 'thing', 'user', 'great', 'get', 'great', 'earth', 'face', 'google', 'company', 'love', 'sxsw', 'sxwsi']",Google,Positive emotion,Google,one thing user great get great earth face google company love sxsw sxwsi,3
"['thanks', 'user', 'mention', 'new', 'speech', 'ipad', 'apps', 'showcased', 'sxsw', 'conf', 'link', 'sxswh', 'sxsh']",iPad or iPhone App,Positive emotion,Apple,thanks user mention new speech ipad apps showcased sxsw conf link sxswh sxsh,3
"['user', 'sxsw', 'provide', 'iphone', 'charger', 'changed', 'mind', 'going', 'next', 'year']",iPhone,Negative emotion,Apple,user sxsw provide iphone charger changed mind going next year,1
"['xmas', 'rt', 'user', 'shiny', 'new', 'user', 'user', 'user', 'apps', 'new', 'user', 'book', 'popup', 'ipad', '2', 'store', 'sxsw', 'christmas', 'nerd']",iPad,Positive emotion,Apple,xmas rt user shiny new user user user apps new user book popup ipad 2 store sxsw christmas nerd,3
"['yai', 'rt', 'user', 'new', 'ubersocial', 'iphone', 'app', 'store', 'includes', 'uberguide', 'sxsw', 'sponsored', 'cont', 'link']",iPhone,Positive emotion,Apple,yai rt user new ubersocial iphone app store includes uberguide sxsw sponsored cont link,3
"['fast', 'fun', 'amp', 'future', 'user', 'google', 'presenting', 'sxsw', 'search', 'local', 'mobile']",Google,Positive emotion,Google,fast fun amp future user google presenting sxsw search local mobile,3
"['headline', 'quotipad', '2', 'musthave', 'gadget', 'sxswquot', 'hmm', 'could', 'seen', 'one', 'coming', 'link', 'gadget']",iPad,Positive emotion,Apple,headline quotipad 2 musthave gadget sxswquot hmm could seen one coming link gadget,3
"['know', 'quotdatavizquot', 'translates', 'quotsatanicquot', 'iphone', 'sayin', 'sxsw']",none,Negative emotion,none,know quotdatavizquot translates quotsatanicquot iphone sayin sxsw,1
"['user', 'quotgoogle', 'launched', 'checkins', 'month', 'agoquot', 'check', 'in', 'ok', 'check', 'out', 'future', 'sxsw', 'bizzy']",Google,Positive emotion,Google,user quotgoogle launched checkins month agoquot check in ok check out future sxsw bizzy,3
"['\x89ûïuser', 'quotgoogle', 'tweetquot', 'new', 'quotthink', 'speakquot', 'mark', 'belinsky', '911tweets', 'panel', 'sxsw\x89û\x9d']",Google,Positive emotion,Google,ûïuser quotgoogle tweetquot new quotthink speakquot mark belinsky 911tweets panel sxswû,3
"['kawasaki', 'quotnot', 'c', 'lewis', 'level', 'reasoning', 'apple', 'continued', 'existence', 'evidence', 'existence', 'godquot', 'bawling', 'sxsw']",Apple,Positive emotion,Apple,kawasaki quotnot c lewis level reasoning apple continued existence evidence existence godquot bawling sxsw,3
"['kawasaki', 'quotpagemaker', 'saved', 'applequot', 'oh', 'day', 'sxsw', 'jwtatl', 'enchantment', 'via', 'user']",Apple,Positive emotion,Apple,kawasaki quotpagemaker saved applequot oh day sxsw jwtatl enchantment via user,3
"['spark', 'android', 'teamandroid', 'award', 'sxsw', 'read', 'link']",none,Positive emotion,none,spark android teamandroid award sxsw read link,3
"['sxsw', 'apple', 'ipad', '2', 'great', 'thought', 'w', 'japan', 'apac', 'region', 'dealing', 'w', 'earthquake', 'amp', 'tsunami', 'trauma', 'sxswi']",iPad,Positive emotion,Apple,sxsw apple ipad 2 great thought w japan apac region dealing w earthquake amp tsunami trauma sxswi,3
"['sxsw', 'apple', 'school', 'marketing', 'expert', 'link']",Apple,Positive emotion,Apple,sxsw apple school marketing expert link,3
"['temporary', 'apple', 'store', 'def', 'tent', 'powerhouse', 'gym', 'sxsw', 'link']",Apple,Positive emotion,Apple,temporary apple store def tent powerhouse gym sxsw link,3
"['temporary', 'apple', 'store', '6th', 'congress', 'sxsw', 'along', '100', 'happy', 'hipster']",Apple,Positive emotion,Apple,temporary apple store 6th congress sxsw along 100 happy hipster,3
"['\x89ûïuser', 'apple', 'win', 'sxsw', 'link', 'opening', 'temporary', 'store', 'downtown', 'austin', 'support', 'ipad2', 'launch', 'good']",Apple,Positive emotion,Apple,ûïuser apple win sxsw link opening temporary store downtown austin support ipad2 launch good,3
"['ipad', 'austin', 'trending', 'today', 'fun', 'sxsw', 'nerdy', 'nerd']",iPad,Positive emotion,Apple,ipad austin trending today fun sxsw nerdy nerd,3
"['christian', 'ipad', 'iphone', 'devs', 'want', 'talk', 'sxsw', 'maybe', 'wk', 'together', 'cool', 'app', 'user']",iPad or iPhone App,Positive emotion,Apple,christian ipad iphone devs want talk sxsw maybe wk together cool app user,3
"['apple', 'ipad2', 'taken', 'sxsw', 'austin', 'storm', 'link', 'user', 'excited', 'part', 'mobile']",iPad,Positive emotion,Apple,apple ipad2 taken sxsw austin storm link user excited part mobile,3
"['haz', 'ipad2', 'ifrom', 'sxsw', 'gr8', 'link']",iPad,Positive emotion,Apple,haz ipad2 ifrom sxsw gr8 link,3
"['stack', 'ipad2s', 'waiting', 'bought', 'sxsw', 'got', 'mine', 'hassle', 'apple', 'handled', 'perfectly', 'link']",iPad,Positive emotion,Apple,stack ipad2s waiting bought sxsw got mine hassle apple handled perfectly link,3
"['smallbiz', 'need', 'review', 'play', 'google', 'placeswe', 'got', 'app', 'thatlink', 'seo', 'sxsw']",none,Positive emotion,none,smallbiz need review play google placeswe got app thatlink seo sxsw,3
"['take', 'sxsw', 'rt', 'user', 'major', 'south', 'korean', 'director', 'get', '1300', 'make', 'movie', 'entirely', 'iphone', 'link']",iPhone,Positive emotion,Apple,take sxsw rt user major south korean director get 1300 make movie entirely iphone link,3
"['beautiful', 'sxsw', 'user', 'apple', 'store', 'sxsw', 'pic', 'link']",Apple,Positive emotion,Apple,beautiful sxsw user apple store sxsw pic link,3
"['must', 'sxsw', 'app', 'rt', 'user', 'lovely', 'review', 'forbes', 'sxsw', 'ipad', 'app', 'holler', 'gram', 'link']",iPad or iPhone App,Positive emotion,Apple,must sxsw app rt user lovely review forbes sxsw ipad app holler gram link,3
"['temporary', 'sxsw', 'apple', 'store', 'apple', 'sneaky', 'usual', 'link']",Apple,Positive emotion,Apple,temporary sxsw apple store apple sneaky usual link,3
"['\x89ûïuser', 'sxsw', 'beta', 'testing', 'interactive', 'book', 'ipad', 'app', 'moonbot', 'studio', 'louisiana', 'cool', 'app\x89û\x9d']",iPad or iPhone App,Positive emotion,Apple,ûïuser sxsw beta testing interactive book ipad app moonbot studio louisiana cool appû,3
"['apple', 'sxsw', 'day', 'one', 'seeing', 'ton', 'ipad2']",iPad,Positive emotion,Apple,apple sxsw day one seeing ton ipad2,3
"['\x89ûïuser', 'sxsw', 'ipad', 'store', 'sold', 'everything', 'except', '64gig', 'wifi', 'white\x89û\x9d', 'user', 'manage', 'get']",iPad,Positive emotion,Apple,ûïuser sxsw ipad store sold everything except 64gig wifi whiteû user manage get,3
"['\x89ûïuser', 'sxsw', 'ipad', 'store', 'sold', 'everything', 'except', '64gig', 'wifi', 'white\x89û\x9d', 'also', 'known', 'white', 'jean', 'configuration']",iPad,Positive emotion,Apple,ûïuser sxsw ipad store sold everything except 64gig wifi whiteû also known white jean configuration,3
"['offered', 'sxsw', 'ipad', 'promo', 'ninjafinder', 'user', 'fan', 'sxsw', 'suck', 'sxsw']",iPad,Positive emotion,Apple,offered sxsw ipad promo ninjafinder user fan sxsw suck sxsw,3
"['poursite', 'sxsw', 'learning', 'lifechanging', 'impact', 'ipad', 'real', 'people', 'actual', 'life', 'bravo']",iPad,Positive emotion,Apple,poursite sxsw learning lifechanging impact ipad real people actual life bravo,3
"['user', 'sxsw', 'lonelyplanet', 'austin', 'guide', 'iphone', 'free', 'limited', 'time', 'link', 'lp', 'travel']",none,Positive emotion,none,user sxsw lonelyplanet austin guide iphone free limited time link lp travel,3
"['apple', 'sxsw', 'store', 'still', 'ipad', '2', 'short', 'line']",iPad,Positive emotion,Apple,apple sxsw store still ipad 2 short line,3
"['left', 'sxsw', 'tradeshow', 'demo', 'user', 'google', 'theatre', 'ok', 'get', 'see', 'presenter', 'using']",Other Google product or service,Positive emotion,,left sxsw tradeshow demo user google theatre ok get see presenter using,3
"['anyone', 'sxsw', 'want', 'make', 'quick', 'hundred', 'dollar', 'new', 'ipad2', 'ad', 'hoc', 'apple', 'store', 'get', 'hundred', 'plus', 'cost']",iPad,Positive emotion,Apple,anyone sxsw want make quick hundred dollar new ipad2 ad hoc apple store get hundred plus cost,3
"['monday', 'sxsw', 'barry', 'diller', 'new', 'york', 'time', 'congress', 'lunch', 'w', 'hotel', 'party', 'google', 'party', 'six', 'dirty', 'martini', 'monday']",Google,Positive emotion,Google,monday sxsw barry diller new york time congress lunch w hotel party google party six dirty martini monday,3
"['seriously', 'sxsw', 'testing', 'mobile', 'apps', 'constant', 'ipad', 'crash', 'causing', 'lost', 'schedule', 'sync', 'wp7']",iPad or iPhone App,Negative emotion,Apple,seriously sxsw testing mobile apps constant ipad crash causing lost schedule sync wp7,1
"['ready', 'sxsw', 'iphone', 'apps', '2', 'make', 'blogging', 'easier', 'link', 'sxsw', 'sxswi']",iPad or iPhone App,Positive emotion,Apple,ready sxsw iphone apps 2 make blogging easier link sxsw sxswi,3
"['ipad2', 'sxswa', 'conflagration', 'doofusness', 'link']",iPad,Negative emotion,Apple,ipad2 sxswa conflagration doofusness link,1
"['attention', 'sxswers', 'link', 'rumored', 'popup', 'temporary', 'apple', 'store', 'sxsw', 'ipad', '2', 'launch', 'need']",Apple,Positive emotion,Apple,attention sxswers link rumored popup temporary apple store sxsw ipad 2 launch need,3
"['went', 'sxswi', 'lousy', 'ipad', 'sxsw', 'link']",iPad,Positive emotion,Apple,went sxswi lousy ipad sxsw link,3
"['winning', 'picture', 'android', 'google', 'sxsw', 'link']",Android,Positive emotion,Google,winning picture android google sxsw link,3
"['spent', '100', 'come', 'sxsw', 'already', 'used', 'ipad', '1', 'wait', 'couple', 'city', 'block', 'ipad2', 'sxsw', 'link']",iPad,Negative emotion,Apple,spent 100 come sxsw already used ipad 1 wait couple city block ipad2 sxsw link,1
"['behind', '100', 'email', 'give', '1', 'line', 'iphone', 'composed', 'reply', 'sxsw', 'protip']",iPhone,Positive emotion,Apple,behind 100 email give 1 line iphone composed reply sxsw protip,3
"['like', '10pm', 'night', 'line', 'around', 'block', 'popup', 'apple', 'store', 'selling', 'ipad2s', 'sxsw']",iPad,Positive emotion,Apple,like 10pm night line around block popup apple store selling ipad2s sxsw,3
"['2', 'ipad', '2', 'seen', 'wild', 'people', 'say', 'fast', 'still', 'pic', 'terrible', 'sxsw']",iPad,Negative emotion,Apple,2 ipad 2 seen wild people say fast still pic terrible sxsw,1
"['ipad', '2', 'take', 'sxsw', 'video', 'user', 'link']",iPad,Positive emotion,Apple,ipad 2 take sxsw video user link,3
"['many', 'ipad', '2', 'snapping', 'away', 'keynote', 'slide', 'sxsw']",iPad,Positive emotion,Apple,many ipad 2 snapping away keynote slide sxsw,3
"['new', 'post', '3', 'iphone', 'apps', 'using', 'south', 'southwest', 'interactive', 'link', 'sxsw', 'sxswi']",iPad or iPhone App,Positive emotion,Apple,new post 3 iphone apps using south southwest interactive link sxsw sxswi,3
"['sweet', 'new', '3d', 'google', 'map', 'demo', 'going', 'ballroom', 'sxsw']",Other Google product or service,Positive emotion,,sweet new 3d google map demo going ballroom sxsw,3
"['35', 'million', 'mile', 'per', 'day', 'driving', 'google', 'map', 'navigation', 'sxsw']",Other Google product or service,Positive emotion,,35 million mile per day driving google map navigation sxsw,3
"['sxsw', 'day', '5', 'apple', 'store', 'still', 'lineand', 'growing', 'link']",Apple,Positive emotion,Apple,sxsw day 5 apple store still lineand growing link,3
"['band', 'sxsw', 'want', 'share', 'track', 'audience', 'stage', 'use', 'frostwire', 'android', 'wifi', 'available']",Android App,Positive emotion,Google,band sxsw want share track audience stage use frostwire android wifi available,3
"['iphone', 'need', 'caruse', 'zimride', 'etc', 'share', 'ride', 'sxsw', 'shareable']",iPad or iPhone App,Positive emotion,Apple,iphone need caruse zimride etc share ride sxsw shareable,3
"['picked', 'mophie', 'battery', 'case', '4', 'iphone', 'prep', 'sxsw', 'lugging', 'around', 'laptop', 'amp', 'using', 'phone', 'huge', 'win', 'last', 'year']",iPhone,Positive emotion,Apple,picked mophie battery case 4 iphone prep sxsw lugging around laptop amp using phone huge win last year,3
"['rumor', 'monger', 'good', 'read', 'å', 'google', 'circle', 'preview', 'user', 'sxsw', 'link', 'user', 'via', 'user', 'socbiz', 'fb']",Other Google product or service,Positive emotion,,rumor monger good read å google circle preview user sxsw link user via user socbiz fb,3
"['hobo', 'shotgun', 'video', 'game', 'coming', 'ipadiphone', 'user', 'yes', 'please', 'link', 'sxsw']",iPad or iPhone App,Positive emotion,Apple,hobo shotgun video game coming ipadiphone user yes please link sxsw,3
"['build', 'store', 'le', '24', 'hour', 'one', 'biggest', 'launch', 'company', 'history', 'got', 'apple', 'sxsw', 'ipad2']",Apple,Positive emotion,Apple,build store le 24 hour one biggest launch company history got apple sxsw ipad2,3
"['read', 'groupme', 'sxswsounds', 'like', 'incredible', 'app', 'available', 'android', 'phone', 'yet']",iPad or iPhone App,Positive emotion,Apple,read groupme sxswsounds like incredible app available android phone yet,3
"['iphone', 'alarm', 'botch', 'timechange', 'many', 'sxswers', 'freak', 'late', 'flight', 'missed', 'panel', 'behind', 'bloody', 'mary']",iPhone,Negative emotion,Apple,iphone alarm botch timechange many sxswers freak late flight missed panel behind bloody mary,1
"['shout', 'lady', 'holding', 'ipad', '2', 'free', 'sxsw', 'show', 'take', 'photo', 'sipping', 'free', 'beer', 'cc', 'user']",iPad,Positive emotion,Apple,shout lady holding ipad 2 free sxsw show take photo sipping free beer cc user,3
"['meant', 'also', 'wish', 'sxsw', 'dyac', 'stupid', 'iphone']",iPhone,Negative emotion,Apple,meant also wish sxsw dyac stupid iphone,1
"['rumor', 'apple', 'store', 'opening', 'sxsw', '6th', 'amp', 'congress', 'sign', 'point', 'yes', 'link']",Apple,Positive emotion,Apple,rumor apple store opening sxsw 6th amp congress sign point yes link,3
"['picked', 'ipad', '2', 'sxsw', 'pop', 'apple', 'store', '15', 'minute', 'wait']",iPad,Positive emotion,Apple,picked ipad 2 sxsw pop apple store 15 minute wait,3
"['brilliant', 'enlightening', 'game', 'mechanic', 'presentation', 'user', 'google', 'sxsw']",Google,Positive emotion,Google,brilliant enlightening game mechanic presentation user google sxsw,3
"['marketing', 'sale', 'genius', 'link', 'apple', 'sxsw']",Apple,Positive emotion,Apple,marketing sale genius link apple sxsw,3
"['need', 'sxsw', 'ipad', 'iphone', 'laptop', 'dictaphone', 'vidcamera', 'wow', 'love', 'meet', 'real', 'cerebellum', 'charged', 'people']",iPhone,Positive emotion,Apple,need sxsw ipad iphone laptop dictaphone vidcamera wow love meet real cerebellum charged people,3
"['sxsw', 'app', 'iphone', 'ridiculous', 'personal', 'planner', 'next', '5', 'day']",iPad or iPhone App,Positive emotion,Apple,sxsw app iphone ridiculous personal planner next 5 day,3
